"","Statute","Type","Degree","Desc"
"1","2-2","L","0","MUNICIPAL ORDINANCE VIOLATION/PAYABLE"
"2","2-11.1(3)(B)","C","0","LIMITATIONS ON CAMPAIGN CONTRIBUTIONS"
"3","2-11.1(D)","C","0","CONFLICT OF INTEREST/CTY OFFC TRANSACTING BUSINESS"
"4","2-11.1(G)","C","0","CONFLICT OF INTEREST/EXPLOIT OFFICIAL POSITION"
"5","2-11.1(I)","C","0","CONFL/INTEREST/CODE OF ETHICS/FINANCIAL DISCLOSURE"
"6","2-11.1(O)","C","0","CONFLICT OF INTEREST/ACQUIRING FINANCIAL INTEREST"
"7","2-11.1(S)(2)","C","0","CONFLICT OF INTEREST/ILLEGAL LOBBYING"
"8","2-11.1(S)(7)","C","0","CONFLICT OF INTEREST/CONTINGENCY FEE AGGREEMENT"
"9","2-11.1(E)(3)","C","0","CONFLICT OF INTEREST/SOLICIT/DEMAND GIFT"
"10","2-11.1(E)(4)","C","0","CONFLICT OF INTEREST/DISCLOSE GIFT"
"11","3-3","C","0","COUNTY ORDINANCE VIOLATION/PAYABLE"
"12","3-14","L","0","ALCOHOL CONSUMPTION VIOLATION"
"13","4-1","L","0","ALCOHOLIC BEVERAGES/DRINKING IN PUBLIC/MIAMI"
"14","4-3","L","0","ALCOHOLIC BEVERAGES/SELLING HOURS VIOLATION/MIAMI"
"15","4-4","L","0","ALCOHOLIC BEVERAGES/ESTABLISHMENT/MINGLING/MIAMI"
"16","4-6","L","0","ANIMAL CRUELTY/MUNICIPAL ORDINANCE/HOMESTEAD"
"17","4-10","L","0","LEASHE/VIOLATION/BAY HARBOR ISLAND"
"18","509.101","L","0","RESTURANTS/SEPARATE RECORDS/PURCHASES/SALES/MIAMI"
"19","509.144","L","0","RESTURANT/REQUIREMENTS/LIGHTING CONDITIONS"
"20","4-14(A)(1)","L","0","ALCOHOLIC BEVERAGE/INCIDENTAL/SALE OF FOOD/MIAMI"
"21","4-14(A)(3)","L","0","RESTURANTS/SEPARATE RECORDS/PURCHASES/SALES"
"22","4-74","L","0","DOGS/COMMITTING NUISANCE/HOMESTEAD ORDINANCE"
"23","4-79","L","0","DOGS/FAILURE TO OBTAIN LICENSE/HOMESTEAD ORDINANCE"
"24","4-9","L","0","RUNNING AT LARGE OF ANIMALS/BAY HARBOR ISLAND"
"25","5-1","C","0","ANIMAL ORDINANCE ENFORCEMENT/COUNTY ORDINANCE"
"26","509.241","L","0","BUSINESS/CONDUCT WITHOUT A LICENSE/MUNICIPAL ORD"
"27","6-2","L","0","ANIMALS/RUNNING AT LARGE/MIAMI"
"28","6-18","L","0","ALCOHOLIC BEVERAGE/CONSUME IN PUBLIC PLACE/CGABLES"
"29","6-193","L","0","SELL/SERVE/VEND IN PUBLIC NEAR SCHOOLS MG MUN ORD"
"30","256.007","L","0","SELL/SERVE/VEND IN PUBLIC NEAR PUBLIC PARKS/MIA GD"
"31","6-195","L","0","SELL/SERVE/VEND/SOLICIT IN PUBLIC GENERAL/MIAMI GD"
"32","6-297","L","0","TITLE CERT/DOC REQ PRIOR DISMAN/WRECK/DEST MTR VH"
"33","6-3","L","0","ALCOHOLIC BEVERAGES/SELLING HOURS VIOL/MIA BEACH"
"34","6-4","L","0","ALCOHOL BEVERAGE/LOCATION VIOL/MIA BEACH"
"35","6-5","L","0","ALCOHOLIC BEVERAGE/POSN BY PERSON <21/MIA BEACH"
"36","6-8","L","2","ALCOHOL BEVERAGE/CONSUMPTION/VIO/FLORIDA CITY"
"37","7-7","L","0","PANHANDLING, BEGGING/MUNICIPAL ORDINANCE"
"38","7-23","C","0","BOAT REGISTRATION VIOLATION/COUNTY ORDINANCE"
"39","7-26","C","0","MOTORBOAT/RESTRICTED ZONES/COUNTY ORDINANCE"
"40","7-3","C","0","SWIM/FISH PROHIBITED FROM ROAD BRIDGE/COUNTY ORDN"
"41","8-10","C","0","BUILDING WITHOUT A PERMIT/COUNTY ORDINANCE"
"42","8-6","N","0","PROHIBITION SIDEWALK/BICYCLE/MOPED/8TH ST/4TH AVE"
"43","8-8","L","0","MUNICIPAL ORDINANCE VIOLATION"
"44","8A-156","C","0","ESTIMATE REQUIRED/MOTORBOATS/M-D COUNTY ORDINANCE"
"45","8A-160.1","C","0","DETAILED INVOICE REQUIRED/MOTORBOATS/M-D ORDINANCE"
"46","8A-161.15","C","0","MOTOR VEHICLE REPAIR/NO WRITTEN ANALYSIS"
"47","8A-161.4","C","0","MOTOR VEHICLE REPAIR SHOP/REGISTRATION REQUIRED"
"48","8A-161.7","C","0","MOTER VEHICLE REPAIR SHOP/RECORDS/HANDLING COMPLAI"
"49","8A-172","C","0","BUSINESS/CONDUCT WITHOUT LICENSE/COUNTY ORDINANCE"
"50","8A-179","C","0","BUSINESS LICENSE/FAILURE TO DISPLAY/COUNTY ORDIN"
"51","8A-229","C","0","GAMBLING, LOTTERY VIOLATION/COUNTY ORDINANCE"
"52","8A-276(B)","C","0","COMMERCIAL VEHICLE MARKINGS VIOLATION/COUNTY ORD"
"53","8A-369(N)","M","2","OBTAIN LOCKSMITH TOOLS/NO PERMIT/M-D COUNTY ORD"
"54","8A-52","C","0","PLANTS/FRUITS/SELL/PURCH/TRNSPT BULK W/O CERT"
"55","8B-7","C","0","CURFEW VIOLATION/COUNTY ORDINANCE"
"56","8A-9.2","C","0","FAILURE TO MAINTAIN RECORDS"
"57","8A-9.3(A)","C","0","CASH PAYMENT/REGULATED METALS/OVER $1,000"
"58","8A-9.(B)","C","0","CASH TRANSACTIONS PROHIBITED ON RESTRICTED METALS"
"59","8A-9.3(C)","C","0","IMPROPER PAYMENT BY CHECK FOR RESTRICTED METALS"
"60","8A-9.4","C","0","UNLAWFUL PURCHASE OF RESTRICTED METALS"
"61","8A-9.5(1)","C","0","PURCHASE OUTSIDE OF BUSINESS HOURS"
"62","8A-9.5(2)","C","0","PURCHASE NOT A FIXED LOCATION"
"63","8A-9.5(3)","C","0","PURCHASE FROM UNLAWFUL SELLER"
"64","8A-9.6","C","0","FAILURE TO SCHEDULE OR COMPLETE TRAINING"
"65","9-9","C","0","COUNTY ORDINANCE VIOLATION"
"66","10-02","C","0","CONTRACTING/CERTIFICATE/COMPETENCY REQ/COUNTY ORDN"
"67","10-3(A)","C","0","CONTRACTOR/SUBCONT/BUSINESS W/O CERTI/COUNTY ORD"
"68","10-10","L","0","RESISTING ARREST WITHOUT VIOLENCE/MUN ORD"
"69","10-4(A)","C","0","CONTRACTOR/REPRESENT AS W/O CERTIFICATE/COUNTY ORD"
"70","11.047(3)","M","1","PUBLIC ORDER CRIMES GIVE TAKE CONTINGENCY FEE FOR"
"71","11-11","L","0","DISORDERLY CONDUCT/MUNICIPAL ORDINANCE"
"72","11.143(4)(A)","F","2","FRAUD-FALSE STATEMENT FALSE SWEARING BEFORE LEGISL"
"73","11.47(2)","M","1","PUBLIC ORDER CRIMES FAIL REFUSE TO MAKE PROPER AUD"
"74","11.47(3)","M","1","PUBLIC ORDER CRIMES FAIL TO FURNISH INFO TO AUD GE"
"75","12-12","L","0","SPITTING ON THE SIDEWALK/MUNICIPAL ORDINANCE"
"76","12-14","C","0","ELECTION/RE/PIC/RET/MORE THAN 2 ABSENTEE BALLOTS"
"77","12-22","C","0","ELECTION CAMPAIGN FINANCING ELIGIBILITY"
"78","13-13","L","0","CHILD NEGLECT, ABUSE/MUNICIPAL ORDINANCE"
"79","14-345","L","0","HYPODERMIC NEEDLE/SALE/DISCARD/MG ORD"
"80","14-364","L","0","RACING/TIP SHEETS/MG ORD"
"81","14-566","L","0","POLICE/AUTHORITY/ENFORCEMENT/MG ORD"
"82","14A-12","C","0","FISH/MARINE LIFE VIOLATION/COUNTY ORDINANCE"
"83","14-14","L","0","OBSTRUCTING A POLICE OFFICER/MUNICIPAL ORDINANCE"
"84","14-161","L","0","SMOKING SPITTING W/CERTAIN PUB VEH PROHIBIT MG MUN"
"85","14-2","L","0","URINATING/DEFACATING IN PUBLIC/MIAMI GARDENS"
"86","14-220","L","0","LOITERING/MIAMI GARDENS MUNICIPAL ORDINANCE"
"87","14-251","L","0","AGGRESIVE OR OBSTRUCT PANHANDLING PROHIBIT/MG ORD"
"88","14-252","L","0","STREET CORNER AUTO WINDOW WASHING/MG MUN ORDINANCE"
"89","14-313","L","0","SALES TO MINORS USE/MG MUNICIPAL ORDINANCE"
"90","14-32","L","0","VIOLATION OF STATE LAW MG MUN ORDINANCE"
"91","14-418","L","0","CURFEW VIOLATION MG MUN ORDINANCE"
"92","14-95","L","0","GRAFFITI PROHIBITED MG MUN ORDINANCE"
"93","15-2","L","0","FIREARM/DISCHARGE/MUNICIPAL ORDINANCE"
"94","015.03","M","2","STATE SEAL VIOLATION"
"95","15-6(B)(1)","C","0","LITTERING AND DUMPING VIOLATION/COUNTY ORDINANCE"
"96","15-6(B)(10)","C","0","LITTER/DUMP BY LANDSCAPE BUSINESS/COUNTY ORDINANCE"
"97","15-6(B)(2)","C","0","LITTERING AND DUMPING IN WATERWAY/COUNTY ORDINANCE"
"98","15-6(B)(3)","C","0","WASTE/DUMPING, BURYING/COUNTY ORDINANCE"
"99","15-6(B)(4)","C","0","LITTER/REFUSE/ALLOW TO ACCUMULATE/COUNTY ORDINANCE"
"100","15-6(B)(5)","C","0","LITTER/ANIMAL CARCASS/UNLAWFUL DISPOSAL/COUNTY ORD"
"101","15-6(B)(6)","C","0","LITTER/GARBAGE/TRASH RECYCLING CENTER/COUNTY ORDIN"
"102","15-6(B)(8)","C","0","LITTER/OBSTRUCT USE OF NEIGHBORHOOD STATION/CTY OR"
"103","15-74","L","0","ALCOHOL/CONSUMPTION IN PUBLIC/SOUTH MIAMI ORD"
"104","16-16","L","0","PROSTITUTION/MUNICIPAL ORDINANCE"
"105","16-25","L","0","CERTAIN SOUNDS CREATING NOISES PROHIBIT/MG MUN ORD"
"106","17-1","C","0","MINIMUM HOUSING REG VIOLATION/COUNTY ORDINANCE"
"107","17-15(A)(B)","C","0","MINIMUM HOUSING STANDARD VIOL/COUNTY ORDINANCE"
"108","17-17","L","0","SLEEPING/PUBLIC PLACE"
"109","18-127","L","0","CONTROL/NUISANCE/ANIMALS/MG ORD"
"110","18-128","L","0","ANIMALS/DOMESTIC/MG ORD"
"111","18-157","L","0","ACTIVITIES/RECREATIONAL/MG ORD"
"112","18-158","L","0","GAMES/DANGEROUS/DESIGNATED/AREAS/MG ORD"
"113","18-159","L","0","SWIMMING/BATHING/WATER/PARKS/MG ORD"
"114","18-160","L","0","FISHING/RESTRICTED/AREAS/MG ORD"
"115","18-182","L","0","BOATING/MG ORD"
"116","18-183","L","0","PICNIC SHELTER PERMIT/MG ORD"
"117","18-184","L","0","CAMPING/PARKS/MG ORD"
"118","18-207","L","0","POLLUTION/WATERS/MG ORD"
"119","18-208","L","0","TRASH/DESTRUCTION/PARK/PROPERTY/MG ORD"
"120","18-912","L","0","STR PERFORM/ART VEN W/O PERM/MIAMI BEACH ORDINANCE"
"121","18-106","L","0","PRESERVATION OF PROPERTY MG MUN ORDINANCE"
"122","18-126","L","0","PROTECTION AND PRESERVATION OF WILDLIFE MG MUN ORD"
"123","18-129","L","0","CLOSING OF PARKS/MIAMI GARDENS MUNICIPAL ORDINANCE"
"124","18-161","L","0","HUNTING AND FIREARMS/MIAMI GARDENS MUN ORDINANCE"
"125","18-162","L","0","TOY FIREARMS/FIREWORKS/EXPLOSIVES/MIAMI GARDENS MO"
"126","18-163","L","0","PICNIC AREAS AND USE/MIAMI GARDENS MUN ORDINANCE"
"127","18-164","L","0","HORSEBACK RIDING/MIAMI GARDENS MUNICIPAL ORDINANCE"
"128","18-18","L","0","DISORDERLY INTOXICATION/MUNICIPAL ORDINANCE"
"129","18-240","L","0","NOISE/MIAMI GARDENS MUNICIPAL ORDINANCE"
"130","18-241","L","0","MERCHANDISING/VENDING/PEDDLING/MIAMI GDNS MUN ORD"
"131","18-242","L","0","ADVERTISING AND PUBLICITY SIGNS/MIAMI GDNS MUN ORD"
"132","18-243","L","0","PUBLIC DEMONSTR/GATHERING/PERFORM/SPCH/MIAMI GDNS"
"133","18-244","L","0","UNDER THE INFLUENCE OF DRUGS AND ALCOHOL INTOX/MG"
"134","18-245","L","0","ALCOHOLIC BEVERAGES/MIAMI GARDENS MUNI ORDINANCE"
"135","18-246","L","0","PROPER USE OF FACILITIES/MIAMI GARDENS MUN ORDER"
"136","18-247","L","0","GAMBLING/MIAMI GARDENS MUNICIPAL ORDINANCE"
"137","18-77","L","0","ROADS/DRIVEWAYS WITHIN PARKS MG MUN ORD"
"138","18-78","L","0","TRUCKS BUSES OTHER HEAVY VEHICLES MG MUN ORDINANCE"
"139","18-80","L","0","PARKING MG MUN ORDINANCE"
"140","18-81","L","0","USE OF VEHICLES MG MUN ORDINANCE"
"141","19-19","L","0","BUILDING AND ZONING VIOLATION/MUNICIPAL ORDINANCE"
"142","20-78","L","0","DISTRIBUTING HANDBILLS PUBLIC PLACES/MG ORD"
"143","20-79","L","0","PROHIBITION/HANDBILLS/VEHICLES/MG ORD"
"144","20-80","L","0","PROHIBITION/SIGNS/POLES/MG ORD"
"145","20-81","L","0","DEPOSITING/HANDBILL/PROPERTY/MG ORD"
"146","20-186","L","0","PERMIT REQUIRED/MG ORD"
"147","20-20","L","0","VEHICLE/UNAUTHORIZED USE/MUNICIPAL ORDINANCE"
"148","20-82","L","0","DISTRIBUTING/DEPOSITING ON PREMISES/MG ORD"
"149","20-83","L","0","POSTING ON BUILDING OR STRUCTURE/MG ORD"
"150","21-3","C","0","PROPERTY/MALICIOUS DESTRUCTION/COUNTY ORDINANCE"
"151","21-3","L","0","PROPERTY/MALICIOUS DESTRUCTION/MUNICIPAL ORDINANCE"
"152","21-51","C","0","MOTOR VEH PARTS DEALER/WRECKER/LICENSE VIOLATION"
"153","21-118","C","0","THEFT OF PLANTS/FRUITS/TRESPASS"
"154","21-133","C","0","BINGO/OWNER/LESSOR PERMIT VIOLATION/COUNTY ORD"
"155","21-136","C","0","BINGO/TAGS REQUIRED NAMING CHARITY/COUNTY ORD"
"156","21-14","C","0","CONCEALED WEAPON/CARRY/COUNTY ORDINANCE"
"157","21-17","C","0","WEAPON/POSN BY FELON/INTOXICATED PERSON/COUNTY ORD"
"158","21-18","C","0","WEAPON/DANGEROUS HANDLING OF/COUNTY ORDINANCE"
"159","21-18.1","C","0","FIREARM/DISCHARGE OVER PRIVATE PROPERTY/COUNTY ORD"
"160","21-20.14","C","0","FIREARM/SELL/DEL/PERSON UNDER INFLUENCE/COUNTY ORD"
"161","21-20(C)","C","0","HANDGUN/72HR WATING PERIOD VIOLATION/COUNTY ORD"
"162","21-20(D)","C","0","HANDGUN/FICTITIOUS NAME ON REGISTRATION/COUNTY ORD"
"163","21-20.18","C","0","FIVE-DAY WAITING PERIOD FIREARMS SALES"
"164","21-207","C","0","CURFEW/PARENTAL RESPONSIBILITY VIOL/COUNTY ORD"
"165","21-21","C","0","ALCOHOLIC BEV/ESTABLISHMENT/SOLICT DRINKS/COUNTY O"
"166","21-21","L","0","ANIMAL ORDINANCE VIOLATION/MUNICIPAL ORDINANCE"
"167","21-21(2)(B)","C","0","ALCOHOL/OPEN HOUSE/PARENTAL RESPONSIBILITY/CTY ORD"
"168","21-21.3","C","0","DRUG PARAPHERNALIA/SALE PROHIBITED/COUNTY ORDINANC"
"169","21-210(A)","C","0","CURFEW/PARENTAL VIOLATION/1ST OFF/COUNTY ORDINANCE"
"170","21-24.1","C","0","FALSE STATEMENTS/RECEIVE BENEFITS/COUNTY ORDINANCE"
"171","21-24(A)","C","0","FALSE ALARM/MAKE/COUNTY ORDINANCE"
"172","21-24(B)","C","0","FALSE REPORT TO POLICE/MAKE/COUNTY ORDINANCE"
"173","21-26","C","0","OBSTRUCT POLICE OFFICER, FIREFIGHTER/COUNTY ORD"
"174","21-26(A)(1)","C","0","RESIST/OBSTRUCT OFFC/FRFIGHTER/COUNTY ORDINANCE"
"175","21-26(A)(2)","C","0","OBSTRUCT/CIVIL/CRIM PROCESS/COUNTY ORDINANCE"
"176","21-26(A)(3)","C","0","OBSTRUCTING JUSTICE/FALSE INFORMATION/COUNTY ORDIN"
"177","21-27.1","C","0","VEND/SELL MERCHANDISE/500 FT OF SCHOOL/COUNTY ORD"
"178","21-27.2","C","0","VEND/SELL MERCHANDISE/500 FT OF PARK/COUNTY ORD"
"179","21-28","C","0","NOISE/PRODUCE LOUD, EXCESSIVE/COUNTY ORDINANCE"
"180","21-281","C","0","SEX OFFENDER/RES VIOL/2500FT SCH/PRK/VIC <16/CTY"
"181","21-284","C","0","SEX OFNDR/PRED/PRESENT IN PARK/CHILD CARE FACILITY"
"182","21-29.1(A)","C","0","UNLAWFUL ADVERTERTISE/DISPLAY MERCH/COUNTY PROPERT"
"183","21-29(B)","C","0","PAWNSHOP/RECORDS TO BE KEPT/COUNTY ORDINANCE"
"184","21-30(1)","C","0","PROPERTY/MALICIOUS DESTRUCTION/COUNTY ORDINANCE"
"185","21-30.01","C","0","GRAFFITI/PROHIBITED/COUNTY ORDINANCE"
"186","21-30.01(G)","C","0","GRAFFITI/SPRAY PAINT/MARKERS/COUNTY ORDINANCE"
"187","21-31.1(A)","C","0","DISORDERLY CONDUCT/COUNTY ORDINANCE"
"188","21-31.1(B)","C","0","LOITERING/OBSTRUCT SIDEWALK/STREET/COUNTY ORD"
"189","21-31(2)(B)(1)","C","0","ALCOHOL/CONSUME NEAR STORE SELLING ALCOHOL/CNTY O"
"190","21-31.2(B)(2)","C","0","ALCOHOL/OPEN CONTAINER/POSN NEAR STOREL/CNTY ORD"
"191","21-31.2(B)(3)","C","0","ALCOHOL/FAIL TO POST CONSUMPTION RULES/COUNTY ORD"
"192","21-31(2)(D)","C","0","ALCOHOLIC BEVERAGE VIOLATION/COUNTY ORDINANCE"
"193","21-31.4(B)","C","0","PANHANDLING/AGGRESSIVE/OBSTRUCTIVE/COUNTY ORD"
"194","21-31(B)","C","0","LOITERING AND PROWLING/COUNTY ORDINANCE"
"195","21-33","C","0","DRAG RACING/AUTO/MOTORCYCLE/ON PUBLIC ROADS"
"196","21-35(D)","C","0","CHEMICAL SUBSTANCE/INTOXICATN BY INHALING/CNTY ORD"
"197","21-36.1","C","0","WINDOW WASHING/STREET CORNER/COUNTY ORDINANCE"
"198","21-36(A)","C","0","SOLICITATION OF BUSINESS/SIDEWALK/COUNTY ORDINANCE"
"199","21-38(A)","C","0","SYRINGE/NEEDLE/SELL W/O PRESCRIPTION/COUNTY ORD"
"200","21-42","C","0","OBSCENE MATERIAL/PERFORMANCE VIOLATION/COUNTY ORD"
"201","21-51","C","0","VEHICLE BUSINESS/LICENSING VIOLATION"
"202","21-56","C","0","VEHICLE RECORDS/FAIL TO MAINTAIN/COUNTY ORDINANCE"
"203","21-57","C","0","VEHICLE/DESTROY W/O TITLE/COUNTY ORDINANCE"
"204","21-81","C","0","COUNTY ORDINANCE/ADOPTION OF STATE LAW"
"205","21-81(A)","C","0","PROSTITUTION/COUNTY ORDINANCE"
"206","21-81(A)","C","0","INDECENT EXPOSURE/COUNTY ORDINANCE"
"207","21-81(A)","C","0","ALCOHOLIC BEVERAGE/POSN BY/SALE TO PERSON <21"
"208","21-81(A)","C","0","PETIT LARCENY, THEFT/COUNTY ORDINANCE"
"209","21-81(A)","C","0","ASSAULT AND BATTERY/COUNTY ORDINANCE"
"210","21-81(A)","C","0","MARIJUANA/POSSESSION/COUNTY ORDINANCE"
"211","21-81(A)","C","0","TRESPASS/COUNTY ORDINANCE"
"212","21-81(A)","C","0","BOATING UNDER THE INFLUENCE/COUNTY ORDINANCE"
"213","21-81(A)","C","0","RESISTING W/O VIOLENCE/ADOPT STATE STAT/COUNTY ORD"
"214","21-81(A)","C","0","DRUGS/POSSESSION OF HARMFUL/COUNTY ORDINANCE"
"215","21-81(A)","C","0","NARCOTIC IMPLEMENTS/POSN OF W/O RESIDUE/COUNTY ORD"
"216","21-81(A)","C","0","LEWD AND LASCIVIOUS BEHAVIOR/COUNTY ORDINANCE"
"217","21-81(A)","C","0","NARCOTIC IMPLEMENTS/POSN OF W/RESIDUE/COUNTY ORD"
"218","21-81(A)","C","0","SUMMONS/FAILURE TO SIGN/COUNTY ORDINANCE"
"219","21-81(A)","C","0","TOBACCO/SELL TO MINOR"
"220","22-22","L","0","SANITARY NUISANCES/MUNICIPAL ORDINANCE"
"221","23-23","L","0","OBSTRUCT PUBLIC STREET, HIGHWAY, ROAD, SIDEWALK"
"222","23-327(35)","L","0","BOAT/OPERATE WHILE UNDER INFL OF ALCOHOL/MUN ORD"
"223","23-50","L","0","INDECENT EXPOSURE/MUNICIPAL ORDINANCE"
"224","24-80","L","0","MOTOR SCOOTER/ TERRAIN/DIRT BK/GO-PD PROHIB/MG ORD"
"225","24-126","L","0","TOWING PERMIT REQD/APPLICATION/MG ORD"
"226","24-1","C","0","ENVIRONMENTAL PROTECTION/GEN VIOLATION/COUNTY ORD"
"227","24.1055(1)","M","2","LOTTERY-PLAYING PERSON UNDER 18 YOA PURCHASE LOTTE"
"228","24.1055(2)","M","1","LOTTERY-OPERATING SELL TICKETS BY MACHINE WITHOUT"
"229","24-11(9)(A)","C","0","POLLUTION/WATER/PROHIBITIONS AGAINST/COUNTY ORD"
"230","24.1160","M","1","LOTTERY-PLAYING UNLAWFUL PURCHASE OF LOTTERY TICKE"
"231","24.1170","M","1","LOTTERY-OPERATING UNLAWFUL SALE OF LOTTERY TICKETS"
"232","24.118(1)","M","2","LOTTERY EXTEND CREDIT TO PURCHASE LOTTERY TICKET"
"233","24.118(2)","M","1","LOTTERY TRANSFER OFFER RIGHT TO CLAIM LOTTERY PRIZ"
"234","24.118(3)","F","3","LOTTERY/COUNTERFEIT/ALTERED TICKET"
"235","24.118(3)(D)","F","3","FRAUD-FALSE STATEMENT FILE FALSE CLAIM FOR PAYMENT"
"236","24.118(4)","F","1","LOTTERY/BREACH OF CONFIDENTIALITY"
"237","24.118(5)(A)","M","1","FRAUD UNLAWFUL REPRESENTATION OF LOTTERY PROGRAM"
"238","24.118(5)(B)","M","1","FRAUD UNAUTHORIZED USE TERMS OF FLORIDA ST LOTTERY"
"239","24-12.3(9)","C","0","ENVIRONMENTAL PROTECTION VIOLATION/COUNTY ORDINANC"
"240","24-157","L","0","NONCONSENT TOWING VIOLATION/MUNICIPAL ORDINANCE"
"241","24-18(4)(D)","C","0","LIQUID WASTE FACILITY/PERMIT VIOLATION/COUNTY"
"242","24-18(A)(4)","C","0","OPERATING PERMITS/WATER TREATMENT FACILITY"
"243","24-22","L","0","ADHERENCE TO RED LIGHT TRAFF CONTROL SIGNAL MG ORD"
"244","24-24","L","0","GAMBLING VIOLATION/MUNICIPAL ORDINANCE"
"245","24-25","C","0","ENVIRONMENTAL PROTECTION VIOLATION/COUNTY"
"246","24-29","C","0","ENFORCEMENT CODE/VIOLATION OF"
"247","24-35.1(4)","C","0","ENVIRONMENTAL PROTECTION/OPERATING PERMIT"
"248","403.413(5)","C","0","ENVIRONMENTAL PROTECTION/SANITARY SEWER/WASTE"
"249","24-48(1)","C","0","SPECIFIC WORK PERMIT/NATURAL/ENVRNMNTL RES/STNDRDS"
"250","25-2.20","C","0","BREACH OF SECURITY/MIAMI INTL AIRPORT/ID BADGE"
"251","25-2.20(A)","C","0","BREACH OF SECURITY/MIAMI INTL AIRPORT/ID BADGE"
"252","25-2.25","C","0","JOSTLING/COUNTY ORDINANCE"
"253","25-2.4","C","0","UNLAW/ENTRY/RESTRICTED AREAS/MIAMI INTERNATION AIR"
"254","25-9.3","C","0","MOTOR VEHICLE/FAILURE TO YIELD TO AIRCRAFT"
"255","25-2.19","C","0","AVIATION DEPT AUTHORIZATION/FORGERY/COUNTERFEIT"
"256","25-2(21)","C","0","BREACH OF SECURITY/MIAMI INTL AIRPORT/COUNTY ORD"
"257","25-2.4","C","0","AIRPORT/ID VIOLATION/COUNTY ORDINANCE"
"258","25-2.15","C","0","AIRPORT/ILLEGAL WEAPONS/COUNTY ORDINANCE"
"259","25-2.21","C","0","AIRPORT/TAMPER/INTERFERE/SECURITY DEVICE/CNTY ORD"
"260","25-25","L","0","PETIT LARCENY, THEFT/MUNICIPAL ORDINANCE"
"261","26-1","C","0","PARKS VIOLATION/ARRESTABLE/COUNTY ORDINANCE"
"262","26-1","C","0","PARKS VIOLATIONS/COUNTY ORDINANCE"
"263","26A-2(A)","C","0","SANITARY NUISANCE VIOLATION/COUNTY ORDINANCE"
"264","26-1 RULE 11","C","0","PARKS/BOAT/ANCHOR,MOOR,TIE UP W/I 200FT OF SHORE"
"265","26-1 RULE 11","N","0","BOAT/ANCHOR, MOOR, TIE UP WITHIN 200 FT OF SHORE"
"266","26-1 RULE 27(B)","C","0","PARKS/GLASS CONTAINER ON BEACH PROHIBITED/CTY ORD"
"267","26-1 RULE 30","C","0","PARKS/ADVERTISING/PUBLICITY/SIGNS/COUNTY ORDINANCE"
"268","26-26","L","0","ASSAULT OR BATTERY/MUNICIPAL ORDINANCE"
"269","26-38(F)","C","0","PARK/CHILD EVENT WORKERS/BACKGROUND CHECK VIOLTN"
"270","26-38 (F)(4)","C","0","PARK/CHILD EVENT WORKER/BACKGROUND CHECK VIOLATION"
"271","26-39(F)","C","0","PARKS/CRIMINAL BACKGRND CHECK/EMPLOYEES/VOLNTRS"
"272","27-27","L","0","LOITERING/MUNICIPAL ORDINANCE"
"273","27.52(7)(C)","M","1","INDIGENT STATUS/FALSE INFORMATION"
"274","28A-10(D)","C","0","SEAPORT/WATCHMEN/LOCATION DIVULGED/COUNTY VIOLATIO"
"275","28A-12.1","C","0","SEAPORT/HINDER/IMPEDE/PEDESTRIANS/VEH/COUNTY VIOLA"
"276","28A-13.10(A)","C","0","SPRT/DRNK INTOX LIQ OTHER THAN DESIG AREA/CNTY VIO"
"277","28A-13.10(B)","C","0","SPRT/OPER MTR VEH/WHILE UND INFL LIQ/DRUGS/CNTY VI"
"278","28A-13.11","C","0","SPRT/PRESC/DISP/ADM/OR W/INTENT/CNTRL SUB/CNTY VIO"
"279","28A-13.12(A)","C","0","SPRT/DOM ANIMAL/CRUISE TERM BUILDING/COUNTY VIOLAT"
"280","28A-13.12(B)","C","0","SPRT/DOM ANIML CNTRL/WILD ANIML W/O PERMIT/CNTY VI"
"281","28A-13.12(C)","C","0","SPRT/WILD ANIML/NOT CONFINED/ENTER PORT/CNTY VIOLA"
"282","28A-13.12(D)","C","0","SPRT/HUNT/PURSUE/TRP/CTCH/KILL ANY ANIMAL/CNTY VIO"
"283","28A-13.12(E)","C","0","SPRT/RIDE HORSEBACK W/O PRIOR DEPT AUTH/CNTY VIOLA"
"284","28A-13.12(F)","C","0","SPRT/ANIML ALLOWED TO URINATE/DEFECATE/CNTY VIOLAT"
"285","28A-13.12(G)","C","0","SPRT/ENCRGE CONGREGATION/BIRDS ETC/VIC/PORT/CNTY V"
"286","28A-13.14","C","0","SPRT/THREAT/FALSE REPORT/SHIPPING/PORT OPER/CNTY V"
"287","28A-13.15","C","0","SPRT/FORGED/CNTRFEIT/ALTER PASS/ID/SIGN ETC/CNTY V"
"288","28A-13.1(A)","C","0","SEAPORT/DIST/EXH/COMM HANDBILLS ETC/PORT PROP/CNTY"
"289","28A-13.1(B)","C","0","SEAPORT/THROW/HNDBILLS ETC/PORT ROADS ETC/CNTY VIO"
"290","28A-13.1(C)","C","0","SEAPORT/NONCOMM HANDBILL DIST/DEPT PROC/CNTY VIOLA"
"291","28A-13.2(A)","C","0","SEAPORT/SOLICITATION/SPEECHMAKING REQ/COUNTY VIOLA"
"292","28A-13.2(G)","C","0","SEAPORT/SEEKING DONATION/DELAY/COERCE/PERSON/CNTY"
"293","28A-13.2(H)","C","0","SEAPORT/AFFIX WRITTEN/GRAPHIC MATTER/PORT STRUCTUR"
"294","28A-13.2(J)","C","0","SEAPORT/SOLICITATION/DIST OF MATLS/DISPLAY ID/CNTY"
"295","28A-13.3(A)","C","0","SEAPORT/DESTROY/TAMPER/STRUCTURE/PORT PROP/CNTY VI"
"296","28A-13.3(B)","C","0","SEAPORT/DEFACE/DISTURB/LNDSCPING/VEGETATION/PORT"
"297","28A-13.3(C)","C","0","SEAPORT/DRIVE ON POSTED LAWN/SEEDED AREA/PORT/CNTY"
"298","28A-13.3(D)","C","0","SEAPORT/WILFULLY ABANDON PERS PROP/PORT/CNTY VIOLA"
"299","28A-13.4","C","0","SEAPORT/ENTRY REST AREA/REQUIREMENTS/COUNTY VIOLA"
"300","28A-13.5","C","0","SEAPORT/FAILURE TO USE COINS/CURRENCY/VENDING MACH"
"301","28A-13.6(A)","C","0","SEAPORT/OBSTRUCT/INTERFER ENJOY PORT PREM/CNTY VIO"
"302","28A-13.6(B)","C","0","SPRT/NO UNCYCL ETC/VEH/BIKE/SPEC ROADS ONLY/CNTY V"
"303","28A-13.6(C)","C","0","SPRT/WTR CRAFT/PROX TO BLKHD LN/BRTHING AREA/CNTY"
"304","28A-13.6(D)","C","0","SPRT/LOUD MUSIC/INT W/QUIET ENJOYMENT OTHERS/CNTY"
"305","28A-13.7(A)","C","0","SPRT/PICKETING ETC/ON PUBLIC ROADS/COUNTY VIOLATN"
"306","28A-13.7(B)","C","0","SPRT/PICKET/MARCH ETC/REST AREA/TERM BLDG/CNTY VIO"
"307","28A-13.8","C","0","SPRT/HINDER/IMPEDE/USE/PASSG ANY AREA PORT/CNTY VI"
"308","28A-13.9(A)","C","0","SPRT/DISP/REFUSE/NOT IN PROVIDED RECEPTACLE/CNTY V"
"309","28A-13.9(B)","C","0","SPRT/DUMP/DISPOSE FILL/BLDG MAT W/O APPRVL/CNTY VI"
"310","28A-13.9(C)","C","0","SPRT/REST ROOM ETC OTHER THAN SANITARY MANNER/CNTY"
"311","28A-13.9(D)","C","0","SPRT/BODILY DISCHARGE ON PORT PROPERTY/COUNTY VIOL"
"312","28A-13.9(E)","C","0","SPRT/FOREIGN OBJ/PLUMBNG FIXTRE PORP PROP/CNTY VIO"
"313","28A-2.4","C","0","OBSTRUCT/INTERFERE W/LEO OR INSPECTION/COUNTY VIOL"
"314","28A-2.7","C","0","SEAPORT/TRESPASS/COUNTY VIOL"
"315","28-28","L","0","TRESPASS/MUNICIPAL ORDINANCE"
"316","28A-3.0","C","0","SEAPORT/RESTRICTED AREA/NO ID/COUNTY VIOLATION"
"317","28A-3.2","C","0","SEAPORT/RESTRICTED AREA/REFUSE INSP/COUNTY VIOLATN"
"318","28A-3.3","C","0","SEAPORT/RESTRICTED AREA/UNAUTH MTR VEH/COUNTY VIOL"
"319","28A-3.4","C","0","SEAPORT/ILLEGAL PARKING/COUNTY VIOLATION"
"320","28A-4.1","C","0","SEAPORT/RESTRICTED AREA/VEH ID RQRMNTS/COUNTY VIOL"
"321","28A-4.2","C","0","SEAPORT/REST AREA/TEMP VEH ID PASS/RQRMNT/CNTY VIO"
"322","28A-4.3","C","0","SPORT/RPTING CHNGS/AP DATA/ANY VEH ID/W/N 30 DAYS"
"323","28A-4.4","C","0","SEAPORT/RESTR AREA/COMM/LEASED VEH ID/COUNTY VIOLA"
"324","28A-4.5(B)","C","0","SEAPORT/VAN LIMO ETC/NO VALID PERMIT/COUNTY VIOLAT"
"325","28A-4.5(C)","C","0","SEAPORT/ACO/RESTR AREA/PRKING TIME LMT/COUNTY VIOL"
"326","28A-4.5(D)","C","0","SEAPORT/OPER MTR VEH/VIOL POSTED SIGN/COUNTY VIOLA"
"327","28A-4.5(E)","C","0","SEAPORT/RENTAL CAR BUS PERMIT/COUNTY VIOLATION"
"328","28A-5.1","C","0","SEAPORT/WEAR ID CARD/RESTRICTED AREA/VIOL/COUNTY"
"329","28A-5.3(D)","C","0","SEAPORT/AP FALSE STMNT/ID CARD/COUNTY VIOLATION"
"330","28A-5.5","C","0","SEAPORT/ID REP RQST/ARREST/OTHER CHNG/AP DATA"
"331","28A-5.7(C)","C","0","SEAPORT/EMPL ID/FAILURE TO RETURN/COUNTY VIOLATION"
"332","28A-5.7(D)","C","0","SEAPORT/ALTERED ID/USE ANOTHER'S ID/COUNTY VIOLATI"
"333","28A-6.1","C","0","SEAPORT/ACT/EMPL/STEVEDORE/NOT LICENSED/COUNTY VIO"
"334","28A-6.2","C","0","SEAPORT/ACT EMPL/STEVEDORE/NO PREMIT/COUNTY VIOLAT"
"335","28A-8.1","C","0","SEAPORT/FAILURE/PRODUCE ID CARD/COUNTY VIOLATION"
"336","28A-8.3","C","0","SEAPORT/LEO/OTHERS/DUTY TO REPORT VIOLATIONS"
"337","28A-9.1","C","0","SEAPORT/ACO/REST AREA/FREIGHT SECURITY/COUNTY VIOL"
"338","28A-9.2","C","0","SEAPORT/ILLEGAL LOADING/COUNTY VIOLATION"
"339","28A-9.3(A)","C","0","SEAPORT/FREIGHT SHORTGE REPORTING REQ/COUNTY VIOLA"
"340","28A-9.3(C)","C","0","SEAPORT/STVDRE RPTNG/FIREARMS/WEAPONS ETC/CNTY VIO"
"341","29-29","L","0","CONCEALED WEAPON/CARRY/MUNICIPAL ORDINANCE"
"342","30B-4(1)","C","0","TRANSIT VEHICLE/IMPEDE OPERATOR/COUNTY ORDINANCE"
"343","30B-4(13)","C","0","TRANSIT PASS CARD/POSN FORGED/COUNTERFEIT/COUNTY"
"344","30B-4(15)","C","0","TRANSIT FARE/REFUSE TO PAY, EVADE/COUNTY ORDINANCE"
"345","30B-4(16)","C","0","TRANSIT TRANSFER/ALTER/ABUSE/GIVE TO ANOTHER"
"346","30-B-4(19)","C","0","TRANSIT EQUIPMENT/UNAUTHORIZED OPERATION/CNTY ORD"
"347","30B-4(2)","C","0","TRANSIT SYSTEM/TRESPASS/COUNTY ORDINANCE"
"348","30-B-4 (20)","C","0","TRANSIT VEH DOOR/INTERFERE W/OPERATION/COUNTY ORD"
"349","30B-4(21)","C","0","TRANSIT VEHICLES/PASS BETWEEN/COUNTY ORDINANCE"
"350","30B-4(27)","C","0","TRANSIT VEHICLES/PASS BETWEEN/COUNTY ORDINANCE"
"351","30B-4(3)","C","0","TRANSIT SYSTEM/DAMAGE PROPERTY/COUNTY ORDINANCE"
"352","30B-4(4)","C","0","TRANSIT GUIDEWAYS, TRACKS/OBSTRUCT/COUNTY ORD"
"353","30B-4(5)","C","0","TRANSIT VEHICLE, STATION/SMOKE, SPIT/COUNTY ORD"
"354","30B-4(6)","C","0","TRANSIT VEHICLE, STATION/EAT, DRINK/COUNTY ORD"
"355","30-450","C","0","PARKING/MISUSE OF SPECIALLY MARKED SPACE/COUNTY CD"
"356","30B-5(1)(C)","C","0","TRANSIT SYSTEM/SOLICIT BUSINESS, TRADE/COUNTY ORD"
"357","30B-7","C","0","TRANSIT/BEG/SOLICIT MONEY/COUNTY ORDINANCE"
"358","30-12","L","0","OBSTRUCT STREET BY SOLICITING/MUNICIPAL ORDINANCE"
"359","30-210.1(A)","C","0","ALCOHOL/OPEN CONTAINER IN VEHICLE/COUNTY ORDINANCE"
"360","30-30","L","0","ALCOHOLIC BEVERAGE VIOLATION/MUNICIPAL ORDINANCE"
"361","30-371(B)","C","0","PRIV SCHOOL BUS/FAIL TO DISPLAY VALID CERTIFICATE"
"362","30-371(F)","C","0","PRIVATE SCHOOL BUS/EXPIRED INSPECTION"
"363","30-371(G)(A)","C","0","PRIVATE SCHOOL BUS/IDENTIFYING MARKINGS"
