"","Statute","Type","Degree","Desc"
"1091","250.45","M","1","CIVIL RIGHTS DISCRIM AGAINST PERSON IN MILITARY UN"
"1092","250.51","M","1","PUBLIC PEACE INSULT BY WORD SIGN GESTURE ORGANIZED"
"1093","250.52","M","1","SEDITION PERSUADE CITIZEN NOT TO ENLIST"
"1094","252.31","M","2","EMERGENCY MANAGEMENT VIOLATION"
"1095","252.5","M","2","HEALTH-SAFETY VIOL DISASTER PREPAREDNESS EMERGENCY"
"1096","252.86(2)","F","3","EMERGENCY MANAGEMENT/FALSE INFO TO EPCRA"
"1097","253.04(3)(A)","N","0","STATE LANDS/SEAGRASS/SCARRING"
"1098","253.04(4)(B)","M","2","RESIST OFFICER REFUSE POST BOND ACCEPT SIGN BOATIN"
"1099","253.72(2)","M","2","TRESPASSING VIOL POSTED RESTRICTIONS LEASED STATE"
"1100","253.72(3)","M","2","CONSERVATION-FISH HARVEST SHELLFISH 25 FT/PROTECTE"
"1101","253.74","M","1","CONSERVATION  CONDUCT AQUACULTURE WO BOARD AUTHORI"
"1102","255.518(8)","F","3","PUBLIC PROPERTY/PAY FINDER FEE RE SALE OF"
"1103","256.05","M","2","DESECRATING FLAG IMPROPER USE SYMBOL OF AUTHORITY"
"1104","256.06","M","2","MUTILATE, DISRESPECT STATE OR US FLAG"
"1105","257.261","M","2","INVADE PRIVACY VIOL CONFID PUBLIC LIBRARY REGIS CI"
"1106","258.007(2)","M","2","CONSERVATION VIOLATE STATE PARK RULES"
"1107","258.008(1)","N","0","STATE PARKS/PROHIBITED ACTIVITIES/VIOLATION"
"1108","258.008(2)","M","2","CONSERVATION FAIL SIGN CITATION APPEAR IN CT FTC C"
"1109","258.008(3)","M","2","STATE PARK/PROHIBITED ACTIVITIES WITHIN BOUNDARIES"
"1110","258.083","M","2","DAMAGE PROP-PUBLIC TAKE CORAL FROM PENNEKAMP CORAL"
"1111","258.157","M","2","PUBLIC ORDER CRIMES ATV/FIREARM SAVANNAS STATE RES"
"1112","258.397","M","2","BISCAYNE BAY ACQUATIC/PRESERVE DESIGNATION"
"1113","258.397","N","0","BISCAYNE BAY PRESERVE/RULE VIOLATION"
"1114","258.501","M","2","CONSERVATION VIOLATE WILD AND SCENIC RIVERS LAW"
"1115","265.706(7)","M","2","PUBLIC ORDER CRIMES CUSTODIAN VIOL CULTURAL HISTOR"
"1116","267.115(7)","M","2","PUBLIC ORDER CRIMES CUSTODIAN VIOL HISTORIC PROPER"
"1117","267.13(1)(B)","F","3","HISTORICAL RESOURCES/REMOVE/DEFACE SITE/SPECIMEN"
"1118","267.13(1)(C)","F","3","HISTORICAL RESOURCES/SELL ARTIFACTS TAKEN ILLEGALY"
"1119","267.13(3)(A)","M","1","FORGERY OF HISTORICAL OBJECT FROM SITE"
"1120","267.13(3)(B)","M","1","FRAUD FALSE LABEL DESCRIBE IDENTIFY AS ETC ARTIFAC"
"1121","273.09","M","2","EMBEZZLE VIOL STATE OWNED TANGIBLE PERSONAL PROP L"
"1122","274.08","M","2","PUBLIC ORDER CRIMES VIOL TANGIBLE PERS PROP OWN BY"
"1123","280.06(1)","M","2","OBSTRUCT VIOLATE ORDER OF CHIEF FINANCIAL OFFICER"
"1124","280.06(2)","F","3","PUBLIC DEPOSITS/FALSE INFO ON FORM"
"1125","281.08","M","1","FRAUD-IMPERSON SAFETY AND CRIME PREVENTION AGENT"
"1126","286.011(3)(A)","N","0","PUBLIC MEETINGS AND RECORDS/VIOL BY PUBLIC OFFICER"
"1127","286.011(3)(B)","M","2","PUBLIC MEETINGS AND RECORDS/VIOLATIONS"
"1128","286.041","M","2","ANTITRUST INSPECT BIDDERS INCOME TAX RETURN"
"1129","287.055(6)","M","1","BRIBERY ILLEGAL PROCURE PERSONAL PROPERTY SERVICES"
"1130","287.094","F","2","MINORITY BUSINESS ENTERPRISE/FALSE CLAIM"
"1131","287.0943(9)","M","1","FRAUD FAIL NOTIFY CHANGE OF OWNERSHIP MINORITY BUS"
"1132","288.039(2)(C)","F","3","BUSINESS/FRAUDULENT TAX REFUND FOR YOUTH EMPLOYEE"
"1133","288.075(7)","M","2","PUBLIC ORDER CRIMES DISCLOSE ECONOMIC DEVELOPMENT"
"1134","288.1045(2)(G)","F","3","ECONOMIC DEVELOPMENT/FALSE STATEMENT ON CLAIM/REFU"
"1135","288.106(2)(E)2","F","3","BUSINESS/TARGET INDUSTRY/FALSE STMT/CLAIM/REFUND"
"1136","288.106(3)(G)","F","3","FRAUD-FALSE STATEMENT FRAUDULENTLY CLAIM TARGET IN"
"1137","288.107(4)(E)","F","3","BUSINESS/BROWNFIELD/FALSE STATEMENT/CLAIM REFUND"
"1138","288.1253(5)","M","2","FRAUD FRAUDULENT TRAVEL OR ENTERTAINMENT CLAIM"
"1139","288.853(3)","F","3","PROPERTY/CONFISCATED CUBAN/TRANSACTION"
"1140","288.853(6)(A)","F","3","CONTRABAND/IMPORT CUBAN SUGAR/SYRUP/MOLASSES"
"1141","288.9551(5)","M","2","INVADE PRIVACY DISCLOSE CONFID SCRIPPS FLORIDA INF"
"1142","288.9626","M","1","PUBLIC ORDER CRIMES VIOL EXEMPT RECORDS OR MEETING"
"1143","288.9627(5)","M","1","DISCLOSE PROPRIETARY CONFID BUSINESS INFO"
"1144","288.985(4)","M","1","PUBLIC ORDER CRIMES DISCLOSE CONFID RECORDS RE MIL"
"1145","298.66","F","3","DRAINAGE CANALS/OBSTRUCT/IMPEDE"
"1146","308.04","M","2","FRAUD-IMPERSON ACT AS PORT SHIPPING MASTER WITHOUT"
"1147","310.161","M","2","PUBLIC ORDER CRIMES PILOT VESSEL WITHOUT LICENSE O"
"1148","311.12(4)(C)","M","1","WEAPON/CONCEALED/POSSESS IN RESTRICTED AREA"
"1149","313.06","M","2","RESIST OFFICER OR OBSTRUCT HARBOR MASTER DISOBEY O"
"1150","316.00","I","0","TRAFFIC INFRACTIONS"
"1151","316.0083(1)(D)4","M","2","TRAFFIC OFFENSE FALSE AFFIDAVIT RE NO LIABILITY FO"
"1152","316.156(1)","I","0","SIGNALS BY HAND AND ARM OR SIGNAL LAMPS"
"1153","316.156(2)","I","0","VEHICLE/SIGNAL LAMPS"
"1154","316.027(1)(B)","F","2","LEAVING SCENE OF CRASH/DEATH/ATTEMPT/7/-1-14"
"1155","316.027(1)(B)","F","1","LEAVING SCENE OF CRASH/DEATH/7-1-14"
"1156","316.027(2)A","F","3","LEAVING SCENE OF CRASH/NO SERIOUS INJURY"
"1157","316.027(2)B","F","2","LEAVING SCENE OF CRASH/SERIOUS BODILY INJURY"
"1158","316.027(2)C","F","1","LEAVING SCENE OF CRASH/DEATH"
"1159","316.061(1)","M","2","LEAVING SCENE OF AN ACCIDENT/PROPERTY DAMAGE"
"1160","316.061(1)","T","0","LEAVING SCENE OF AN ACCIDENT/PROPERTY DAMAGE"
"1161","316.062(1)","I","0","ACCIDENT/FAIL TO GIVE AID OR INFORMATION"
"1162","316.062(2)","I","0","ACCIDENT/FAIL TO GIVE AID OR INFORMATION"
"1163","316.063(1)","M","2","LEAVE SCENE OF ACCIDENT/DAMAGE/UNATTENDED VEHICLE"
"1164","316.063(1)","T","0","LEAVE SCENE OF ACCIDENT/DAMAGE/UNATTENDED VEHICLE"
"1165","316.065(1)","I","0","ACCIDENT/FAIL TO REPORT"
"1166","316.065(4)","M","1","TRAFFIC OFFENSE REPAIR VEHICLE W BULLET DAMAGE WO"
"1167","316.066(1)(D)","I","0","FAIL TO PROVIDE PROOF OF INSURANCE"
"1168","316.066(6)(B)","F","3","CRASH REPORT/DISCLOSE CONFIDENTIAL INFORMATION"
"1169","316.066(6)(C)","F","3","CRASH REPORT/OBTAIN INFORMATION NOT ENTITLED"
"1170","316.066(6)(D)","F","3","CRASH REPORT/USE CONFIDENTIAL INFORMATION"
"1171","316.067","M","2","ACCIDENT/FALSE REPORT"
"1172","316.067","T","0","ACCIDENT/FALSE REPORT OF"
"1173","316.072","I","0","TRAFFIC LAWS/FAILURE TO OBEY"
"1174","316.072(3)","M","2","POLICE OFFICER, FIREFIGHTER/FAILURE TO OBEY"
"1175","316.072(3)","T","0","POLICE OFFICER/FIREFIGHTER/FAILURE TO OBEY"
"1176","316.074","I","0","TRAFFIC CONTROL DEVICE/DISOBEY"
"1177","316.0741","I","0","HOV LANE VIOLATION"
"1178","316.0747(1)","M","2","PUBLIC ORDER CRIMES NONGOV ENT USE OF TRAF CONT DE"
"1179","316.0747(2)","M","2","PUBLIC ORDER CRIMES FAIL TO INSTALL TRAF CONT DEV"
"1180","316.075(1)(C)1","I","0","TRAFFIC LAWS/RUN RED LIGHT"
"1181","316.076","I","0","FLASHING SIGNALS/DISOBEY"
"1182","316.0765","I","0","TRAFFIC/LANE DIRECTION CONTROL"
"1183","316.0775(1)","M","2","INTRF W/TRF CONT DEV/RR SIGN/DAMAGE/$200 OR LESS"
"1184","316.0775(1)","T","0","INTRF W/TRF CONT DEV/RR SIGN/DAMAGE/$200 OR LESS"
"1185","316.078(1)","I","0","DETOUR SIGN/FAIL TO OBEY"
"1186","316.081","I","0","FAILURE TO DRIVE ON THE RIGHT SIDE OF THE ROADWAY"
"1187","316.083(3)","I","0","IMPROPER PASSING"
"1188","316.084","I","0","IMPROPER PASSING ON RIGHT"
"1189","316.085","I","0","LANE CHANGING/IMPROPER"
"1190","316.087","I","0","IMPROPER PASS/CURVE/VIOLATION"
"1191","316.0875","I","0","NO PASSING ZONE/VIOLATION"
"1192","316.088(2)","I","0","DRIVE WRONG DIRECTION ON ONE WAY STREET"
"1193","316.089","I","0","IMPROPER LANE USAGE"
"1194","316.089(3)","I","0","IMPROPER CHANGE OF LANE OR COURSE"
"1195","316.0895","I","0","FOLLOW TOO CLOSELY"
"1196","316.090","I","0","DRIVE ON THE WRONG SIDE OF A DIVIDED HIGHWAY"
"1197","316.1001","I","0","TOLL/NONPAYMENT"
"1198","316.1001(3)","M","2","TOLL/NONPAYMENT/FALSE AFFIDAVIT"
"1199","316.1001(3)","T","0","TOLL/NONPAYMENT/FALSE AFFIDAVIT"
"1200","316.121(1)","I","0","VEHICLE/FAIL TO YEILD IN INTERSECTION"
"1201","316.121(2)","I","0","VEHICLE/FAIL TO YIELD/INTERSECTION/VEH ON RIGHT"
"1202","316.121(3)","I","0","VEHICLE/FAIL TO YIELD/NO TRAFFIC CONTROL DEVICE"
"1203","316.121(4)","I","0","VEHICLE/FAIL TO YIELD/FROM UNPAVED ROAD"
"1204","316.122","I","0","IMPROPER LEFT TURN"
"1205","316.123","I","0","FAILURE TO YIELD RIGHT OF WAY"
"1206","316.1235","I","0","VEHICLE/INTERSECTION/TRAFFIC LIGHTS INOPERATIVE"
"1207","316.125","I","0","VEHICLE/ENTER HIGHWAY FROM PRIVATE ROAD/DRIVEWAY"
"1208","316.126(1)","I","0","VEHICLE/FAIL TO YIELD TO EMERGENCY VEHICLE"
"1209","316.130(15)","I","0","DUE CARE/FAILURE TO USE/PEDESTRIANS"
"1210","316.130(7)","I","0","PEDESTRIAN/VEHICLE TO YIELD RIGHT OF WAY"
"1211","316.130(8)","I","0","PEDESTRIAN/WALK/RUN INTO PATH OF ONCOMING VEHICLE"
"1212","316.1301(1)","M","2","NONBLIND PERSON/CARRY WHITE CANE"
"1213","316.1301(1)","T","0","NONBLIND PERSON/CARRY WHITE CANE"
"1214","316.1301(2)","I","0","BLIND PEDESTRIAN/FAIL TO YIELD TO"
"1215","316.1305","I","0","NO FISHING FROM STATE ROAD BRIDGE"
"1216","316.151(1)","I","0","TRAFFIC/IMPROPER TURN"
"1217","316.1515","I","0","IMPROPER U-TURN"
"1218","316.154","I","0","IMPROPER START OF PARKED VEHICLE/VIOLATION"
"1219","316.155","I","0","VEHICLE SIGNAL/TURN/STOPL"
"1220","316.172(1)(A)","I","0","FAILURE TO STOP FOR SCHOOL BUS"
"1221","316.172(1)(B)","I","0","PASS ON ENTER/EXIT SIDE OF SCHOOL BUS"
"1222","316.183","I","0","SPEEDING VIOLATION"
"1223","316.185","I","0","TRAFFIC/UNDUE CARE"
"1224","316.187","I","0","SPEEDING VIOLATION/STATE ROAD"
"1225","316.189","I","0","SPEEDING/MUNICIPAL, COUNTY VIOLATION"
"1226","316.1895","I","0","SPEEDING IN A SCHOOL ZONE"
"1227","316.191(2)(A)","M","1","DRAG RACING/HIGHWAY"
"1228","316.191(2)(A)","T","0","DRAG RACING/HIGHWAY"
"1229","316.191(2)(B)","M","1","DRAG RACING/HIGHWAY/FACILITATE"
"1230","316.191(2)(B)","T","0","DRAG RACING/HIGHWAY/FACILITATE"
"1231","316.191(2)(C)","M","1","DRAG RACING/HIGHWAY/PASSENGER"
"1232","316.191(2)(C)","T","0","DRAG RACING/HIGHWAY/PASSENGER"
"1233","316.191(2)(D)","M","1","DRAG RACING/HIGHWAY/STOP OR SLOW TRAFFIC"
"1234","316.191(2)(D)","T","0","DRAG RACING/HIGHWAY/STOP OR SLOW TRAFFIC"
"1235","316.191(4)(A)","I","0","DRAG RACING/HIGHWAY/DRAG RACE SPECTATOR/VIOLATION"
"1236","316.192","M","2","RECKLESS DRIVING"
"1237","316.192","T","0","RECKLESS DRIVING"
"1238","316.192(1)(A)","T","0","RECKLESS DRIVING"
"1239","316.192(3)(ABC)1","T","0","RECKLESS DRIVING/DAMAGE TO PROPERTY OR PERSON"
"1240","316.192(3)(C)1","M","1","RECKLESS DRIVING/DAMAGE TO PROPERTY/PERSON"
"1241","316.192(3)(C)1","T","0","RECKLESS DRIVING/DAMAGE TO PROPERTY/PERSON"
"1242","316.192(3)(C)2","F","3","RECKLESS DRIVING/SERIOUS BODILY INJURY"
"1243","316.1925","I","0","CARELESS DRIVING"
"1244","316.1925","I","0","CARELESS DRIVING/WITH DEATH"
"1245","316.1926(1)","F","3","MOVING TRAFFIC VIOL MOTORCYCLE MOPED LAW THIRD VIO"
"1246","316.1926(1)","I","0","ADDITIONAL OFFENSE/MOTORCYCLES/MOPEDS"
"1247","316.1926(2)","F","3","MOVING TRAFFIC VIOL SPEED LIMIT LAW THIRD VIOL"
"1248","316.1926(2)","I","0","ADDITIONAL OFFENSE/EXCEED SPEED LIMIT >50 MPH"
"1249","316.193(1)","M","1","DRIVING UNDER THE INFLUENCE"
"1250","316.193(1)","M","2","DRIVING UNDER THE INFLUENCE"
"1251","316.193(1)","M","2","DRIVING UNDER THE INFLUENCE/ON BICYCLE"
"1252","316.193(1)","T","0","DRIVING UNDER THE INFLUENCE"
"1253","316.193(1)","T","0","DRIVING UNDER THE INFLUENCE/ON BICYCLE"
"1254","316.193(1)(A)","M","2","DUI/NORMAL FACULTIES IMPAIRED"
"1255","316.193(1)(A)","T","0","DUI/NORMAL FACULTIES IMPAIRED"
"1256","316.193(1)(B)","M","2","DUI/UNLAWFUL BLOOD LEVEL"
"1257","316.193(1)(B)","T","0","DUI/UNLAWFUL BLOOD LEVEL"
"1258","316.193(1)(C)","M","2","DUI/UNLAWFUL BREATH ALCOHOL LEVEL"
"1259","316.193(1)(C)","T","0","DUI/UNLAWFUL BREATH ALCOHOL LEVEL"
"1260","316.193(2)(B)","F","3","DRIVING UNDER THE INFLUENCE/3RD OR SUBSEQUENT CONV"
"1261","316.193(2)(B)3","F","3","DUI/ALCOHOL OR DRUGS/4TH OR SUBSEQUENT OFFENSE"
"1262","316.193(3)(ABC)2","F","3","DUI/SERIOUS BODILY INJURY TO ANOTHER"
"1263","316.193(3)(ABC)1","M","1","DUI/DAMAGE TO PROPERTY OR PERSON"
"1264","316.193(3)(ABC)1","T","0","DUI/DAMAGE TO PROPERTY OR PERSON"
"1265","316.193(3)(C)2","F","3","DRIVING UNDER THE INFLUENCE/SERIOUS BODILY INJURY"
"1266","316.193(3)(C)3","F","2","DRIVING UNDER THE INFLUENCE/MANSLAUGHTER"
"1267","316.193(3)(C)3A","F","2","DRIVING UNDER THE INFLUENCE/MANSLAUGHTER"
"1268","316.193(3)(C)3B","F","1","DUI MANSLAUGHTER/FAILURE TO RENDER AID"
"1269","316.193(4)","M","1","DUI/BAL .15 OR >/ACCOMPANIED BY MINOR IN VEHICLE"
"1270","316.193(4)","T","0","DUI/BAL .15 OR >/ACCOMPANIED BY MINOR IN VEHICLE"
"1271","316.1935(1)","F","3","FLEEING/ELUDING POLICE OFFICER/ATTEMPT"
"1272","316.1935(1)","F","3","FLEEING ELUDING POLICE OFFICER"
"1273","316.1935(2)","F","3","FLEEING/ELUDE PO/LIGHTS & SIREN"
"1274","316.1935(3)(A)","F","2","FLEEING/ATT ELUDE PO/MARKED/HIGH SPEED"
"1275","316.1935(3)(B)","F","1","FLEEING/ELUDING/PO/HIGH SPEED/INJURY/DEATH"
"1276","316.1935(3)(B)","F","L","FLEEING/ELUDING/PO/HIGH SPEED/INJURY/DEATH/DWEAPON"
"1277","316.1935(4)(A)","F","2","AGG FLEE/ATT ELUDE PO AFTER ACCDENT/INJUR/DAMAGE"
"1278","316.1935(4)(B)","F","1","FLEEING/ELUDING/AGGRAVATED/INJURY/DEATH"
"1279","316.1936","I","0","ALCOHOL/OPEN CONTAINER IN VEHICLE"
"1280","316.1936(2)(A)","I","0","ALCOHOL/OPEN CONTAIN VEHICLE/OPER/DRIVER"
"1281","316.1936(2)(A)","I","0","ALCOHOL/OPEN CONTAIN VEHICLE/OPER/PASSENGER"
"1282","316.1936(2)(B)","I","0","ALCOHOL/OPEN CONTAIN VEHICLE/STOPPED/PASSENGER"
"1283","316.1936(2)(B)","I","0","ALCOHOL/OPEN CONTAIN VEHICLE/STOPPED/DRIVER"
"1284","316.1939","M","1","DUI/DWI/REFUSAL TO TEST AFTER LIC SUSPENSION"
"1285","316.1939","T","0","DUI/DWI/REFUSAL TO TEST AFTER LIC SUSPENSION"
"1286","316.1939(1)","M","1","DUI/DWI/TESTING/2ND OR SUBSEQUEST REFUSAL"
"1287","316.1939(1)","T","0","DUI/DWI/TESTING/2ND OR SUBSEQUENT REFUSAL"
"1288","316.1939(1)(E)","M","1","DUI/DWI/TESTING/2ND OR SUBSEQUENT REFUSAL"
"1289","316.1939(1)(E)","T","0","DUI/DWI/TESTING/2ND OR SUBSEQUENT REFUSAL"
"1290","316.194","I","0","VEHICLE/STOP/STAND/PARK OUTSIDE MUNICIPALITY"
"1291","316.1945(1)(A)","I","0","STOP/STAND/PARK VEHICLE/PROHIBITED"
"1292","316.1945(1)(A)10","I","0","VEHICLE/IMPROPER/NO PARKING"
"1293","316.1945(1)(B)","I","0","VEHICLE/STOPPING/STANDING/PARKING/PROHIBITED"
"1294","316.195","I","0","VEHICLE/PARKING REGULATION/VIOLATION"
"1295","316.1955(1)","I","0","PARKING VIOLATIION/DISABILITIES"
"1296","316.1975","I","0","UNATTENDED MOTOR VEHICLE"
"1297","316.1985","I","0","IMPROPER BACKING UP"
"1298","316.1995","I","0","VEHICLE/DRIVE ON SIDEWALK/BIKE PATH"
"1299","316.2005","I","0","VEHICLE DOORS/OPENING AND CLOSING"
"1300","316.2015","I","0","VEHICLE/RIDE ON EXTERIOR"
"1301","316.2034","I","0","CROSSING FIRE HOSE"
"1302","316.2035(4)","T","0","UNLAW SOLID/AIRLESS-TYPE TIRES"
"1303","316.2045(1)","I","0","OBSTRUCTING TRAFFIC/PUBLIC STREETS/HIGHWAYS/ROADS"
"1304","316.2045(2)","M","2","OBSTRUCTING TRAFFIC/SOLICI W/O PERMIT/PEDESTRIAN"
"1305","316.2045(2)","T","0","OBSTRUCTING TRAFFIC/SOLICIT W/O PERMIT"
"1306","316.2051","I","0","DRIVE ON RIMS/STEEL TIRES/UNLAWFUL"
"1307","316.2061","I","0","TRAFFIC/FAILING TO STOP WHEN OBSTRUCTION"
"1308","316.2074(5)","I","0","IMPROPER OPERATION ON PUB RD/ST"
"1309","316.209(2)","I","0","OPERATING MOTORCYCLES ON ROADWAYS LANED FOR TRAFFI"
"1310","316.211","I","0","MOTORCYCLE EQUIPMENT VIOLATION"
"1311","316.2123","I","0","ATV/IMPROPER OPERATION ON CERTAIN ROADWAYS"
"1312","316.215","I","0","DEFECTIVE EQUIPMENT"
"1313","316.217(1)","I","0","DRIVING WITHOUT HEADLIGHTS"
"1314","316.220(1)","T","0","HEADLAMPS ON MOTOR VEHICLES"
"1315","316.221","I","0","VEHICLE TAILLAMP VIOLATION"
"1316","316.234(1)","I","0","TRAFFIC/VEHICLE STOP LAMP TINTED"
"1317","316.238(1)(A)","I","0","IMPROPER USE OF HIGH BEAM"
"1318","316.238(1)(B)","I","0","IMPROPER USE OF HIGH BEAM/300FT REAR"
"1319","316.2397","I","0","VEHICLE LIGHTS/BLUE/RED PROHIBITED"
"1320","316.2398","I","0","EMERGENCY EQUIPMENT/VIOLATION"
"1321","316.2398(2)","I","0","UNLAWFUL DISPLAY RED FLASH LIGHT"
"1322","316.2398(3)","I","0","UNLAWFUL USE RED LIGHT BY FIREMAN"
"1323","316.2398(4)","I","0","UNLAWFUL USE RED LIGHT BY MEDICAL"
"1324","316.271","I","0","HORN/WARNING DEVICE"
"1325","316.2935(1)(A)","M","2","SELL/LEASE MOTOR VEH W/TAMPERED POLLUTION CONTROL"
"1326","316.2935(1)(A)","T","0","SELL/LEASE MOTOR VEH W/TAMPERED POLLUTION CONTROL"
"1327","316.2935(1)(B)","M","2","VEHICLE/FALSE CERTIFICATE OF POLLUTION CONTROL"
"1328","316.2935(1)(B)","T","0","VEHICLE/FALSE CERTIFICATE OF POLLUTION CONTROL"
"1329","316.2935(5)(B)","M","1","HEALTH-SAFETY TAMPER WITH POLLUTION CONTROL DEVICE"
"1330","316.2952(2)","I","0","VEHICLE WINDSHIELD/COVERING MATERIAL VIOLATION"
"1331","316.2953","I","0","VEHICLE SIDE WINDOWS/SUNSCREENING RESTRICTIONS"
"1332","316.2954","I","0","WINDOWS BEHIND DRIVER TINTED"
"1333","316.2956(1)","I","0","ILLEGAL SUNSCREENING/OPERATE VEHICLE"
"1334","316.302(11)","M","1","COMMERCIAL VEHICLE/BEARS FALSE ID/7/16"
"1335","316.302(11)","T","0","COMMERCIAL VEHICLE/BEARS FALSE ID/7/16"
"1336","316.302(12)","M","1","COMMERCIAL VEH BEARS FALSE ID NUMBER"
"1337","316.302(4)","M","1","HAZARDOUS MATERIAL W/O COMP W/FED REGS/7/16"
"1338","316.302(4)","T","0","HAZARDOUS MATERIAL W/O COMP W/FED REGS/7/16"
"1339","316.302(5)","M","1","HAZARDOUS MATERIAL W/O COMPLY W/FED REGS"
"1340","316.302(8)","I","0","COMMERCIAL VEHICLE/INSPECTION/DRIVERS REC/7/16"
"1341","316.302(8)(B)","M","2","COMMERCIAL VEH/INSPECT/FAILURE TO COMPLY/W/O VLNCE"
"1342","316.302(8)(B)","T","0","COMMERCIAL VEH/INSPECT/FAILURE COMPL/W/O VIO/7/16"
"1343","316.302(9)","M","1","FTC REQUEST FOR INSPECTION OF COM VEH WO VIOL"
"1344","316.302(9)","F","3","FTC REQUEST FOR INSPECTION OF COM VEH W VIOL"
"1345","316.3026(2)","F","3","MOTOR VEHICLE/COMMERCIAL/OUT OF SERVICE ORDER"
"1346","316.3027","I","0","COMMERCIAL VEHICLE/NO REQUIRED IDENTIFICATION"
"1347","316.3045(1)","I","0","VEHICLE/BOOM BOX VIOLATION"
"1348","316.405(1)","T","0","NO MOTORCYCLE HEADLIGHTS"
"1349","316.455","I","0","MOTORCYCLE EQUIPMENT VIOLATION"
"1350","316.520","M","2","LOAD DROP/SHFT/LEAK/BLOW OFF/NOT COVRD/BI/DEATH"
"1351","316.520","T","0","LOAD DROP/SHIFT/LEAK/BLOW OFF/NOT COVERED/INJ/DEAT"
"1352","316.520(1)","M","2","VEHICLE CARGO/SECURING LOAD/INJURY/DEATH"
"1353","316.520(1)","T","0","VEHICLE CARGO/SECURING LOAD/INJURY/DEATH"
"1354","316.520(2)","M","2","VEHICLE CARGO/FAIL TO SECURE/INJURY/DEATH"
"1355","316.520(2)","T","0","VEHICLE CARGO/FAIL TO SECURE/INJURY/DEATH"
"1356","316.520(3)","M","2","VEHICLE CARGO/FAIL TO SECURE/SERIOUS INJURY/DEATH"
"1357","316.520(3)","T","0","VEHICLE CARGO/FAIL TO SECURE/SERIOUS INJURY/DEATH"
"1358","316.520(3)(B)","M","2","VEHICLE CARGO/ESCAPE/CAUSE INJ/DEATH"
"1359","316.520(3)(B)","T","0","VEHICLE CARGO/ESCAPE/CAUSE INJ/DEATH"
"1360","316.525(1)","I","0","IMPROPERLY SECURED LOAD"
"1361","316.545(1)","F","3","VEHICLE WEIGHT OFFICER/RESIST/OBSTRUCT"
"1362","316.545(1)","M","1","RESIST OFFICER REFUSE WEIGHT SAFETY OFFICER"
"1363","316.605","I","0","VEHICLE WITH NO TAG"
"1364","316.610","I","0","VEHICLE/DRIVE WHILE IN UNSAFE CONDITION"
"1365","316.613","I","0","CHILD RESTRAINT VIOLATION"
"1366","316.6135(1)(A)","M","2","MOTOR VEHICLE/CHILD <6 UNATTENDED >15 MINUTES"
"1367","316.6135(1)(A)","T","0","MOTOR VEHICLE/CHILD <6 UNATTENDED >15 MINUTES"
"1368","316.6135(1)(B)","I","0","MOTOR VEHICLE/CHILD <6 UNATTENDED"
"1369","316.6135(4)","F","3","MOTOR VEHICLE/CHILD <6 UNATTENDED/BODILY HARM"
"1370","316.614","I","0","SAFETY BELT/FAILURE TO USE"
"1371","316.614(4)","I","0","SEAT BELT VIOLATION"
"1372","316.646","I","0","INSURANCE/FAIL TO HAVE IN IMMEDIATE POSSESSION"
"1373","316.646(1)","I","0","VEHICLE INSURANCE/NO PROOF"
"1374","316.646(4)","M","1","INSURANCE/PROOF REQUIRED/MISREPPRESENTED"
"1375","316.646(4)","T","0","INSURANCE/PROOF REQUIRED/MISREPRESENTED"
"1376","316.72","M","2","PUBLIC ORDER CRIMES SIMULATE COLOR OF BUS TO RESEM"
"1377","316.80(1)","F","3","VEHICLE/POSN W/ILLEGAL TANK/CONTAINER"
"1378","316.80(2)","F","3","FUEL/OBTAIN FRAUDULENTLY/10/1/16"
"1379","316.80(2)","F","2","FUEL/OBTAIN FRAUDULENTLY"
"1380","317.0009(2)","F","3","VEHICLE/OFFHIGHWAY/CERT OF OWNRSHP/FLS/FRAUDLT"
"1381","317.0012(1)","F","3","VEHICLE/OFFHIGHWAY/PROCURE/PASS/STOLEN TITLE"
"1382","317.0012(2)","F","3","VEHICLE/OFFHIGHWAY/POSS/SELL/FORGE/CERT TITLE"
"1383","317.0012(3)","F","3","VEHICLE/OFFHIGHWAY/FRG/FLS NM/OBT GOODS"
"1384","317.0017","F","3","VEHICLE/OFFHIGHWAY/ID NUMBERS/POSS/SELL USE/ILLEG"
"1385","317.0017(2)","F","3","FRAUD USE INVALID UNLAW ATV DOCS GET GOODS SERVICE"
"1386","317.0017(3)","F","3","FRAUD USE UNLAW ATV TITLE OBTAIN GOODS SERVICES"
"1387","317.0017(4)","F","3","FRAUD POSSESS SELL UNLAWFUL ATV DOCUMENTS"
"1388","317.0017(5)","F","3","FRAUD POSSESS SELL MFGR UNLAWFUL ATV VIN PLATE"
"1389","317.0018(1)","M","2","NONMOVING TRAFFIC VIOL SELL TRANSFER ATV WO GIVING"
"1390","317.0018(2)","M","2","NONMOVING TRAFFIC VIOL OPERATE ATV WITH NO OR CANC"
"1391","317.0018(3)","M","2","NONMOVING TRAFFIC VIOL FAIL SURRENDER ATV TITLE TO"
"1392","317.0018(4)","M","2","NONMOVING TRAFFIC VIOL FAIL SURRENDER TITLE FOR CH"
"1393","317.0018(5)","M","2","NONMOVING TRAFFIC VIOL VIOLATE ATV LAW OR RULE"
"1394","318.14(3)","M","2","REFUSAL TO ACCEPT/SIGN/SUMMONS"
"1395","318.14(3)","T","0","REFUSAL TO SIGN & ACCEPT SUMMONS"
"1396","319.14","M","2","VEHILE/POLICE/CAB/LEASE/SELL/W/O USED STAMP"
"1397","319.14(2)","M","2","REBUILT VEHICLE/UNLAWFUL SALE/EXCHANGE"
"1398","319.14(3)","M","2","FRAUD SELL TAXI POLICE REBUILT CAR WO NOTICE OF US"
"1399","319.14(5)","M","2","FRAUD UNLAWFUL INTENT TO SELL/EXCH VEH OR MOTOR HO"
"1400","319.14(6)","F","3","VEHICLE/REBUILT/REMOVE DECAL W/INTENT"
"1401","319.22(5)","M","1","VEHICLE/TRANSFER TITLE WITH NO PURCHASER NAME"
"1402","319.225(4)","M","2","ODOMETER DISCLOSURE STATEMENT/FAILURE TO COMPLETE"
"1403","319.2250(6)(D)","M","2","FRAUD FAIL TO COMPL ALL DOCS FOR TRANSF OF VEH TIT"
"1404","319.2250(8)","M","2","FRAUD FAIL TO COMPL REQ INFO FOR USED VEH AT AUCT"
"1405","319.24(7)","M","2","PUBLIC ORDER CRIMES FAIL RETURN CERTIFICATE TITLE"
"1406","319.261(9)","M","2","FRAUD-FALSE STATEMENT MISREPRESENT INFO RE TITLE T"
"1407","319.28(2)(B)","F","3","VEHICLE/SOLD/FAIL TO DISCLOSE REPOSSESSED"
"1408","319.30","F","3","VEHICLE/DISMANTLE, DESTROY, CHANGE ID/SALVAGE"
"1409","319.30(2)(B)","F","3","VEHICLE/SELL/TRANS/FALSE AFFIDAVIT"
"1410","319.30(2)(C)","F","3","VEHICLE/INDUCE FALSE ASSERTION ON TITLE"
"1411","319.30(4)","F","3","VEHICLE W/O MANUFACTURER ID(VIN) NUMBER/POSSESSION"
"1412","319.30(5)(A)","F","3","VIN PLATE/POSSESSION, SALE/SALVAGE"
"1413","319.30(5)(B)","F","3","VIN PLATE REMOVED FROM VEHICLE/POSSESSION, SALE"
"1414","319.30(7)(A)","F","3","SECONDARY METAL RECYCLER RECORDS/FAIL TO MAINTAIN"
"1415","319.30(7)(B)","F","3","SECONDARY METAL RECYCLER RECORDS/FAIL TO MAINTAIN"
"1416","319.30(7)(C)","F","3","SECONDARY METAL RECYCLER RECORDS/FAIL TO MAINTAIN"
"1417","319.30(7)(D)","F","3","SECONDARY METAL RECYCLER RECORDS/FAIL TO MAINTAIN"
"1418","319.30(7)(E)","F","3","SECONDARY METAL RECYCLER RECORDS/FAIL TO MAINTAIN"
"1419","319.30(8)(A)","F","3","SALVAGE DEALER/FAIL TO RETURN CERTIFICATE TO STATE"
"1420","319.30(8)(B)","F","3","SALVAGE DEALER/FAIL TO MAINTAIN RECORDS"
"1421","319.33(1)(A)","F","3","VEHICLE TITLE/FORGE, ALTER"
"1422","319.33(1)(B)","F","3","VEHICLE TITLE/FORGED, ALTERED/RETAIN, USE"
"1423","319.33(1)(C)","F","3","STOLEN VEHICLE/PROCURE, PASS TITLE OF"
"1424","319.33(1)(D)","F","3","VEHICLE WITH ALTERED ID/POSSESSION, SALE"
"1425","319.33(1)(E)","F","3","VEHICLE TITLE/FRAUD IN APPLICATION FOR"
"1426","319.33(2)","F","3","VEHICLE TITLE/INVALID/OBTAIN GOODS WITH"
"1427","319.33(3)","F","3","VEHICLE TITLE REQUIRED TO BE SURRENDERED/OBT GOODS"
"1428","319.33(4)","F","3","VEHICLE TITLE/POSSESSION WITH INTENT TO DEFRAUD"
"1429","319.33(5)","F","3","VIN, DECAL/POSSESSION OF COUNTERFEIT"
"1430","319.33(7)(A)","F","3","MOTOR VEHICLE/OPERATE ON STREET W/O ID NUMBER"
"1431","319.33(7)(B)","F","3","VEHICLE IDENTIFICATION MARK/DEFACED/ALTERED"
"1432","319.35","F","3","ODOMETER ALTERING OR TAMPERING/MOTOR VEHICLE"
"1433","320.02(1)","M","2","VEHICLE REGISTRATION/FAILURE TO HAVE"
"1434","320.02(1)","T","0","VEHICLE REGISTRATION/FAILURE TO HAVE"
"1435","320.02(13)(D)","M","2","TRAFFIC OFFENSE DISABLE REMOVE TAMPER UNLOCK IMMOB"
"1436","320.02(4)","M","2","MOTOR VEH REG/FAIL TO NOTIFY DHSMV OF ADDR CHANGE"
"1437","320.02(4)","T","0","MOTOR VEH REG/FAIL TO NOTIFY DHSMV OR ADDR CHANGE"
"1438","320.02(5)C","M","1","ALTER/COUNTERFEITING/FAL AFF/PROOF OF INSURNACE CA"
"1439","320.02(5)C","T","0","ALTER/COUNTERFEITING/FAL AFF/PROOF OF INSURNACE CA"
"1440","320.02(6)","M","2","VEHICLE REGISTRATION/FALSE, FRAUDULENT REPRESENTN"
"1441","320.02(6)","T","0","VEHICLE REGISTRATION/FALSE, FRAUDULENT REPRESENTN"
"1442","320.02(7)","M","1","FRAUD FALSE PROOF ON EXEMPT OF VEHICLE WEIGHT TAX"
"1443","320.0605","I","0","VEHICLE/REGISTRATION CERTIFICATE REQUIRED"
"1444","320.061","M","2","LICENSE/UNLAWFULLY ALTER"
"1445","320.061","T","0","LICENSE/UNLAWFULLY ALTER"
"1446","320.07(1)","I","0","EXPIRED REGISTRATION"
"1447","320.07(3)","I","0","NO TAG OR REGISTRATION"
"1448","320.07(3)(A)","T","0","VEHICLE REGISTRATION/EXPIRED/< 6 MONTHS"
"1449","320.07(3)(B)","M","2","VEHICLE REGISTRATION/EXPIRED MORE THAN 6 MONTHS"
"1450","320.07(3)(B)","T","0","VEHICLE REGISTRATION/EXPIRED MORE THAN 6 MONTHS"
"1451","320.07(3)(C)","M","2","VEHICLE REGISTRATION/EXP OVER 6 MOS/SUBSEQUENT OFF"
"1452","320.07(3)(C)","T","0","VEHICLE REGISTRATION/EXP OVER 6 MOS/SUBSEQUENT OFF"
"1453","320.071","M","2","PUBLIC ORDER CRIMES USE MOBILE HOME VALIDATION STI"
"1454","320.0803","M","2","PUBLIC ORDER CRIMES FAIL TO REGISTER MOPED"
"1455","320.0807","M","2","NONMOVING TRAFFIC VIOL DISPLAY SPECIAL STATE PLATE"
"1456","320.0848(6)","M","1","HANDICAP PERMIT/FALSE STATEMENT IN APPLICATION"
"1457","320.0848(6)","T","0","HANDICAP PERMIT/FALSE STATEMENT IN APPLICATION"
"1458","320.0848(7)","M","2","HANDICAP PERMIT/OBTAIN/USE/UNLAWFULLY"
"1459","320.0848(7)","T","0","HANDICAP PERMIT/OBTAIN/USE/UNLAWFULLY"
"1460","320.0898(5)","M","2","FRAUD OBTAIN SPECIAL TAG"
